{
  "$schema": "./stage1-acceptance-contract.schema.json",
  "schemaVersion": 1,
  "stage": "stage1",
  "contractVersion": 1,
  "status": "FROZEN",
  "baseline": {
    "flywayPublishedVersion": "1",
    "frontendExistingOperationCount": 37,
    "frontendExistingMissingOperationCount": 0,
    "backendExpectedTestCountAtDesignTime": 84
  },
  "designInputs": [
    "../requirements/stage1-requirements-contract.md",
    "../authorization/permission-matrix.md",
    "../architecture/ADR-001-task-identity-and-assignment.md",
    "../architecture/ADR-002-weekly-review-visibility.md",
    "../architecture/ADR-003-role-boundaries.md",
    "../architecture/ADR-004-permission-service.md",
    "../database/v2-data-dictionary.md",
    "../api/api-compatibility-contract.md",
    "../risk/stage1-risk-register.md"
  ],
  "gates": [
    {
      "id": "S1-A-001",
      "domain": "database",
      "requirement": "V2 installs on an empty MySQL 8.0.41 database and upgrades an installed V1 database",
      "status": "PASS",
      "targetPr": "PR2",
      "evidenceRequired": ["empty database report", "V1 to V2 upgrade report", "Flyway history"]
    },
    {
      "id": "S1-A-002",
      "domain": "database",
      "requirement": "Published V1 remains byte-identical and V2 is immutable after publication",
      "status": "PASS",
      "targetPr": "PR2",
      "evidenceRequired": ["migration checksum test"]
    },
    {
      "id": "S1-A-003",
      "domain": "assignment",
      "requirement": "Invalid assignees written to the database equals zero and every real assignment change is auditable",
      "status": "PASS",
      "targetPr": "PR4",
      "evidenceRequired": ["assignment integration tests", "assignment reconciliation report"],
      "evidence": [
        "PR4 D2-E acceptance record",
        "PR #49 merge commit 5d5c4a23dd01b5a272054862f936d32bb9ad5beb",
        "PR #50 merge commit f6951cc8d986a2bd30fc352f37e1bec7a773af17",
        "GitHub Actions run 33240816476 (post-merge)",
        "PR #51 merge commit eec04c6741e03a4b386ecd9f94f60ac97f0b237f",
        "GitHub Actions run 33241345632 (post-merge)",
        "GitHub Actions run 33239260276",
        "Maven verification: 432 tests, 0 failures, 0 errors",
        "Flyway empty/existing database gates",
        "Docker runtime and migration gate"
      ]
    },
    {
      "id": "S1-A-004",
      "domain": "team",
      "requirement": "Leaving or removing a member unassigns all incomplete team tasks atomically",
      "status": "PASS",
      "targetPr": "PR5",
      "evidenceRequired": ["transaction tests", "concurrency tests"],
      "evidence": [
        "PR5 final acceptance record",
        "PR #53 merge commit cf084eb7c7b7b663af623bf56c16f629f271407d",
        "PR #54 merge commit 777f46a92665fbce057d9fbd1a498b6b700be58d",
        "PR #55 merge commit c2798c26fcaf093e56419184850fa729c170aa64",
        "GitHub Actions run 33262101089 (post-merge)",
        "Maven verification: 507 tests, 0 failures, 0 errors, 0 skipped",
        "WP5-D/E/F real MySQL concurrency, transaction, and reconciliation tests",
        "Flyway empty/existing database gates",
        "Docker runtime and migration gate"
      ]
    },
    {
      "id": "S1-A-005",
      "domain": "authorization",
      "requirement": "Unauthorized access allowed count equals zero for the frozen permission matrix",
      "status": "PASS",
      "targetPr": "PR3",
      "evidenceRequired": ["parameterized permission matrix test report"],
      "evidence": ["PR3 final acceptance record", "PermissionMatrixParameterizedTest (173 invocations)", "Backend CI expected test count 366"]
    },
    {
      "id": "S1-A-006",
      "domain": "privacy",
      "requirement": "Private weekly review content returned to non-authors equals zero",
      "status": "PASS",
      "targetPr": "PR6",
      "evidenceRequired": ["serialization tests", "multi-user authorization tests"],
      "evidence": [
        "PR6 C5 final acceptance record",
        "PR #63 merge commit e284fffda9788627c7488c8cf633231a122abe6d",
        "GitHub Actions run 33348660533 (post-merge)",
        "WeeklyReviewSharedVOContractTest",
        "WeeklyReviewMapperReadPermissionMySqlTest",
        "Backend CI: 554 tests, 0 failures, 0 errors, 0 skipped",
        "PRIVATE rows excluded from team shared projection",
        "V1/V2 migration guard and Flyway gates passed"
      ]
    },
    {
      "id": "S1-A-007",
      "domain": "performance",
      "requirement": "Batch authorization for 100 resources does not execute per-resource authorization queries",
      "status": "PASS",
      "targetPr": "PR3",
      "evidenceRequired": ["query-count test or equivalent SQL evidence"],
      "evidence": ["PR3 WP4-C acceptance record", "CI run 33167613189"]
    },
    {
      "id": "S1-A-008",
      "domain": "ai-security",
      "requirement": "Existing AI endpoints reject nonexistent or unauthorized business IDs before model invocation",
      "status": "PASS",
      "targetPr": "PR6",
      "evidenceRequired": ["AI authorization regression tests"],
      "evidence": [
        "PR6 C5 final acceptance record",
        "PR #63 merge commit e284fffda9788627c7488c8cf633231a122abe6d",
        "GitHub Actions run 33348660533 (post-merge)",
        "AiServiceImplWeeklyPolishAuthorizationTest: unauthorized and missing explicit task IDs rejected before AiModelClient invocation",
        "AiServiceImplTodayOrderTest: missing and unauthorized explicit task IDs rejected before AiModelClient invocation",
        "AiServiceImplDailyReviewRenameTest: missing and unauthorized explicit task IDs rejected before AiModelClient invocation",
        "AiServiceImplListReplanAuthorizationTest: preview/confirm/execute reject unauthorized or missing list IDs before model/operation access",
        "Backend CI: 564 tests, 0 failures, 0 errors, 0 skipped"
      ]
    },
    {
      "id": "S1-A-009",
      "domain": "api-contract",
      "requirement": "All 37 existing frontend operations remain present and every new frontend operation matches runtime OpenAPI",
      "status": "PENDING",
      "targetPr": "PR8",
      "evidenceRequired": ["frontend contract", "runtime OpenAPI comparison report"]
    },
    {
      "id": "S1-A-010",
      "domain": "regression",
      "requirement": "Personal project, task, weekly review, and existing AI breakdown core paths have no regression",
      "status": "PENDING",
      "targetPr": "PR8",
      "evidenceRequired": ["backend tests", "frontend tests", "full-stack evidence"]
    },
    {
      "id": "S1-A-011",
      "domain": "release",
      "requirement": "A cross-repository candidate binds exact backend/frontend SHAs and all stage1 evidence hashes",
      "status": "PENDING",
      "targetPr": "PR8",
      "evidenceRequired": ["candidate manifest", "evidence checksums"]
    },
    {
      "id": "S1-A-012",
      "domain": "release",
      "requirement": "Stage1 tag and release are created only after every required gate passes",
      "status": "PENDING",
      "targetPr": "PR8",
      "evidenceRequired": ["protected merge", "tag", "release record"]
    }
  ]
}
